{
  "id": "99e91d5f-492d-5341-a1a6-023dd3ba0ca6",
  "job_id": null,
  "evidence_type": "weather_forecast",
  "source": "National Weather Service",
  "source_record_id": "SGX/62,76:2026-09-23T20:36:02+00:00",
  "observed_at": "2026-09-23T20:36:02Z",
  "retrieved_at": "2026-09-24T06:49:32.406011Z",
  "geometry": {
    "type": "Polygon",
    "coordinates": [
      [
        [
          -117.2774,
          34.1094
        ],
        [
          -117.2819,
          34.1317
        ],
        [
          -117.3088,
          34.128
        ],
        [
          -117.3042,
          34.1057
        ],
        [
          -117.2774,
          34.1094
        ]
      ]
    ]
  },
  "properties": {
    "office": "SGX",
    "grid": "SGX/62,76",
    "hourly": false,
    "generated_at": "2026-09-24T02:17:52+00:00",
    "periods": [
      {
        "name": "Tonight",
        "start": "2026-09-23T19:00:00-07:00",
        "end": "2026-09-24T06:00:00-07:00",
        "is_daytime": false,
        "temperature": 69,
        "temperature_unit": "F",
        "precip_probability_pct": 0,
        "wind_speed": "0 to 5 mph",
        "wind_direction": "S",
        "short_forecast": "Clear"
      },
      {
        "name": "Thursday",
        "start": "2026-09-24T06:00:00-07:00",
        "end": "2026-09-24T18:00:00-07:00",
        "is_daytime": true,
        "temperature": 97,
        "temperature_unit": "F",
        "precip_probability_pct": 3,
        "wind_speed": "0 to 10 mph",
        "wind_direction": "W",
        "short_forecast": "Sunny"
      }
    ]
  },
  "quality_flags": [],
  "limitations": [
    "Forecasts are predictions and may change; check weather.gov for current conditions."
  ],
  "source_url": "https://www.weather.gov/documentation/services-web-api"
}
